clothing,411AD092E6119FAA8C4EE75A42EB27AC,https://cnfair.com/detail/PI24030085816
FEAR OF GOD ESSENTIALS multi-line FOG letter printed 3M reflective simple versatile round neck sweatshirt,农村人卖潮牌,https://cnfair.com/detail/PI24030076249
FEAR OF GOD ESSENTIALS multi-line FOG letter printed 3M reflective simple versatile round neck sweatshirt,农村人卖潮牌,https://cnfair.com/detail/PI24030076250
2122 Inter Milan Jersey 2021 Lautaro Inter Milan Home and Away Team Uniforms Adult Children's Football Uniform Set,中强体育球衣店,https://cnfair.com/detail/PI24030076259
European and American high street niche rap fashion brand blue and red towel embroidered hoodie loose casual trousers,尖端潮流工作室,https://cnfair.com/detail/PI24030076262
Manufacturer in stock wholesale new knitted hats for men and women in autumn and winter brand hats European and American cross-border pullover woolen hats cold hats,广州市冠煌帽业商行,https://cnfair.com/detail/PI24030076265
EE casual fitness shorts men's muscle sports five-point pants mesh breathable basketball training pants street trend mid-pants,Musclemania官方店,https://cnfair.com/detail/PI24030076266
"FOG multi-line ESSENTIALS pure cotton trousers for men and women, the same FOG high street fashion brand casual leggings sweatpants",原创潮流社,https://cnfair.com/detail/PI24030076269
K248#,PingAn,https://cnfair.com/detail/PI24030076270
ARCTERYX hooded casual assault jacket 197194,Big Dongle seller,https://cnfair.com/detail/PI24030076272
Mountain bike downhill 46 downhill suit Cycling clothing short-sleeved tops mountain off-road motorcycle racing clothing custom made,东莞批发定制骑行服,https://cnfair.com/detail/PI24030076274
2022 World Cup Portugal Cristiano Ronaldo Felix pre-match warm-up suit competition training suit Cristiano Ronaldo,Pro:Direct Soccer,https://cnfair.com/detail/PI24030076277
Hoodie,50436AFCD7332F2671FEEE0117DC1F4E,https://cnfair.com/detail/PI24030076278
FEAR OF GOD multi-line ESSENTIALS reflective letter printing FOG men's and women's same style pure cotton casual shorts,农村人卖潮牌,https://cnfair.com/detail/PI24030076279
Pants,411AD092E6119FAA8C4EE75A42EB27AC,https://cnfair.com/detail/PI24030076282
European and American trendy brand letter printed casual loose sweatshirt Y2K hip hop street men and women pullover tops jacket trendy ins,防弹少年团TRAPSTAR外贸服装店,https://cnfair.com/detail/PI24030076283
EE print shorts Printed logo Sweatpants mesh Drawstring American shorts,我需要0042894584元,https://cnfair.com/detail/PI24030076285
Chelsea Inter Milan Atletico Madrid Training Wear Football Wear Long Sleeve Main Suit Half Zip Jersey Wholesale Dropshipping,广州市隆广服饰商行,https://cnfair.com/detail/PI24030076286
Subway Hooligan letter print short sleeves,地铁小流氓,https://cnfair.com/detail/PI24030076287
FEAR OF GOD ESSENTIALS multi-line FOG letter printed 3M reflective simple versatile round neck sweatshirt,农村人卖潮牌,https://cnfair.com/detail/PI24030076294
FEAR OF GOD ESSENTIALS multi-line FOG letter printed 3M reflective simple versatile round neck sweatshirt,农村人卖潮牌,https://cnfair.com/detail/PI24030076295
"FOG multi-line ESSENTIALS reflective printed trousers, men's trendy sports and leisure leggings sweatpants, the same style for men and women",FFOG,https://cnfair.com/detail/PI24030076296
23SS 64651 SWEAT SHORTS TOPSTONEY shorts,Top Stoney,https://cnfair.com/detail/PI24030076298
European and American high street niche rap brand Trapstar blue and red towel embroidered hoodie loose casual trousers,尖端潮流工作室,https://cnfair.com/detail/PI24030076299
Clothes Commit Tax Fraud Short Sleeve Men Graphic Tshirt,德品服装店,https://cnfair.com/detail/PI24030076300
TRAVIS SCOTT x KAWS lightning joint skull print cardigan sweatshirt for men and women loose hooded jacket,农村人卖潮牌,https://cnfair.com/detail/PI24030076303
2021 autumn and winter new trendy brand cold hat woolen hat knitted hat long coarse grain warm Korean style Japanese hat e-commerce,广州宏鸿帽业商行,https://cnfair.com/detail/PI24030076304
"EE American fitness shorts, muscular men's sports quarter pants, European and American stars' same style mesh breathable beach shorts",Musclemania官方店,https://cnfair.com/detail/PI24030076306
A warehouse cz200HD4490IUQ,repcourier,https://cnfair.com/detail/PI24030076307
Korean style hat women's new V letter versatile rolled edge wool hat autumn and winter style cold hat warm knitted hat men's trend,义乌市佳谱电子商务商行,https://cnfair.com/detail/PI24030076310
revenge embroidered logo straight jeans high street trendy trousers loose casual pants for men students teenagers,农村人卖潮牌,https://cnfair.com/detail/PI24030076311
revenge embroidered logo straight jeans high street trendy trousers loose casual pants for men students teenagers,农村人卖潮牌,https://cnfair.com/detail/PI24030076312
8-color knitted fabric health cloth can be used as sweatpants,好运布料行,https://cnfair.com/detail/PI24030076313
European and American trend Halloween series printed hot diamond hooded cardigan zipper loose men's and women's trendy brand sweatshirt jacket fn,欧美服饰印花店Shopping apparel T Shirt sweater,https://cnfair.com/detail/PI24030076315
White pocket sides ⑤ color velvet trousers 3101810,花生收割机,https://cnfair.com/detail/PI24030076316
GALLERY DEPT basic letter printed logo drawstring trousers pure cotton ankle casual pants men's and women's sweatpants,农村人卖潮牌,https://cnfair.com/detail/PI24030076318
Chelsea Inter Milan Atletico Madrid Training Wear Football Wear Long Sleeve Main Suit Half Zip Jersey Wholesale Dropshipping,广州市隆广服饰商行,https://cnfair.com/detail/PI24030076321
zxbk9219,相逢一笑2002,https://cnfair.com/detail/PI24030076328
"EE American fitness shorts, muscular men's sports quarter pants, American muscle casual sweat-wicking casual street running",Musclemania官方店,https://cnfair.com/detail/PI24030076331
"Logan Trendy, fashionable and simple co-branded logo printed woven trousers",Logan 2025,https://cnfair.com/detail/PI24030076332
"Cross-border special supply of black painted holes, wild European and American version zipper decoration, personalized new jeans for men D2",广州蓝钻服装有限公司,https://cnfair.com/detail/PI24030076333
Foreign trade wholesale summer Trapstar white blue towel embroidered short-sleeved shorts for men and women loose casual suits trendy,广州柏鹿服饰商行,https://cnfair.com/detail/PI24030076337
Correct version of PALM Palm Angel velvet rainbow pants trousers men's high street straight pants Angels velvet pants,直销潮牌店,https://cnfair.com/detail/PI24030076339
Trendy brand shark camouflage zipper sweatshirt for young men and women trendy personality hoodie street hip-hop student clothes jacket,木子潮品168,https://cnfair.com/detail/PI24030076340
Summer Rainbow Angel Trendy Tie Side Woven Striped Sports Casual Loose Quarter Pants Men and Women Couple Casual Shorts,DQ外贸潮品服装批发,https://cnfair.com/detail/PI24030076341
Ambition Vintage Mini Swoosh Travis Scott matching hoodie,AMBITION Official,https://cnfair.com/detail/PI24030076343
545 Owen the same paragraph spring and autumn new men's jacket air layer cotton large size leisure sports hooded sweater 279,天天运动风行者,https://cnfair.com/detail/PI24030076345
PAYDAY new eight-color candy Emanuel European and American high street EE shorts beach pants sports and leisure men,PAYDAY244,https://cnfair.com/detail/PI24030076348
European and American trends 2023 Y2K new NOFS hoodie Gothic punk rock hip-hop sweatshirt set two-piece set,欧美服饰印花店Shopping apparel T Shirt sweater,https://cnfair.com/detail/PI24030076349
NIKE remake Nike fleece sweatshirt Vintage Mini Swoosh Travis Scott's same style Nike fleece hoodie,长红贸易1.0,https://cnfair.com/detail/PI24030076351
2224#NK new embroidered velvet thickened round neck sweatshirt,长红贸易1.0,https://cnfair.com/detail/PI24030076360
Angel King TS detachable hooded cotton jacket,ANGELKING47,https://cnfair.com/detail/PI24030076362
Summer men's new sports running casual breathable sweat-wicking large LOGO slim fit woven nine-point pants 9991,右右外贸出品,https://cnfair.com/detail/PI24030076365
clothing,411AD092E6119FAA8C4EE75A42EB27AC,https://cnfair.com/detail/PI24030076366
Embroidered double fish hook thin jacket off-white suit 3111920,日出20228602,https://cnfair.com/detail/PI24030076370
Special price running quantity exported to American team basketball rugby ice hockey student fleece hooded pullover sweatshirt men's large size,波哥库存尾货男装工作室,https://cnfair.com/detail/PI24030076371
Special price running quantity exported to American team basketball rugby ice hockey student fleece hooded pullover sweatshirt men's large size,波哥库存尾货男装工作室,https://cnfair.com/detail/PI24030076372
Factory ready new quick-drying drawstring fisherman hat wholesale thin basin hat for women and men summer outdoor waterproof fishing,广州宏鸿帽业商行,https://cnfair.com/detail/PI24030076373
sweater,SNOOPY工作室,https://cnfair.com/detail/PI24030076374
EE American casual shorts men's fitness shorts muscular men's basketball sports quarter pants exclusively for Europe and the United States cross-border,深圳市龙岗区北极狼人服装厂,https://cnfair.com/detail/PI24030076378
Factory direct sales new hat wholesale brand trendy knitted hat men's thickened woolen hat autumn and winter solid color,广州宏鸿帽业商行,https://cnfair.com/detail/PI24030076380
Represent Owners' Club hoodie 450g heavyweight pure cotton loose terry hooded sweatshirt,UnionKingdom,https://cnfair.com/detail/PI24030076381
"Foreign trade EE casual shorts, American style four-quarter pants, fitness and sports trendy brand, below the knee mesh breathable quick-drying pants cross-border",上饶市吉米电子商务有限公司,https://cnfair.com/detail/PI24030076382
EE print shorts Printed logo Sweatpants mesh Drawstring American shorts,我需要神仙元2,https://cnfair.com/detail/PI24030076387
KID SEE GHOSTS Kids Meet Ghost Sweatshirt CPFM Kanye's same high street beauty trendy pullover KSG hoodie,NO PHONE,https://cnfair.com/detail/PI24030076388
2324 Miami home and away No. 10 Messi International Major League Soccer Suit Children's Adult Jersey,广州市堂庄号贸易有限责任公司,https://cnfair.com/detail/PI24030076390
Retro cargo pants minus twostreet multi-pocket printed hip hop y2k loose men's trendy pants,TrapstarLondon,https://cnfair.com/detail/PI24030076391
European and American punk hotties letter printed tube top dress street sexy slim backless red hip skirt,rockbaby奇异杂货铺,https://cnfair.com/detail/PI24030076393
"Angel's new casual sports shorts for men and women, breathable, micro-elastic, quick-drying, side webbing, rainbow color waist drawstrings",广州鸿允商贸有限公司,https://cnfair.com/detail/PI24030076395
Passed GX ASSC ANTI short-sleeved fog cherry blossom t-shirt social men's and women's basic joint trendy club burgundy,This Is Sad Too,https://cnfair.com/detail/PI24030076396
NK fleece sweatshirt Vintage Mini Swoosh Travis Scott's same style fleece hoodie,长红贸易1.0,https://cnfair.com/detail/PI24030076397
"[No Returns, No Exchanges] Women's Nude Sports Tight 9-Point Yoga Pants Free shipping",肥猫外贸童装铺,https://cnfair.com/detail/PI24030076401
"Carhartt wip Kahart trousers, soft trousers, retro couple street trend, Japanese style for men and women",Carhartt卡哈特线上店,https://cnfair.com/detail/PI24030076402
apparel,a80ea41ae5f6b7b992ee2b016fac7c82,https://cnfair.com/detail/PI24030076403
Shark head camouflage hooded zipper cardigan sweatshirt early autumn loose casual student versatile couple coat ins trend,铅笔男服饰,https://cnfair.com/detail/PI24030076404
FEAR OF GOD multi-line ESSENTIALS reflective letter printing FOG men's and women's same style pure cotton casual shorts,农村人卖潮牌,https://cnfair.com/detail/PI24030076405
Correct version of gallery dept hand-painted splashed ink stitching drawstring high street casual sweatpants slightly flared long pants for men,FFCP Studios,https://cnfair.com/detail/PI24030076406
"Autumn and winter velvet men's work clothes, stain-resistant and wear-resistant hooded cardigan sweatshirt for construction workers at construction sites",新亨文艺男,https://cnfair.com/detail/PI24030076407
Trendy brand shark camouflage zipper sweatshirt for young men and women trendy personality hoodie street hip-hop student clothes jacket,木子潮品168,https://cnfair.com/detail/PI24030076410
European and American West Coast trendy brand Eric Emanuel EE Shorts shorts summer boys fitness running shorts men,陈衣铺子,https://cnfair.com/detail/PI24030076411
Y2K Skull pattern retro street style hoodie Gothic punk Harajuku Japanese zipper sweatshirt couple style,防弹少年团TRAPSTAR外贸服装店,https://cnfair.com/detail/PI24030076415
DIME 2022ss three-dimensional embroidery LOGO jeans American high street style Same style for men and women tide,Ohhi SHOP,https://cnfair.com/detail/PI24030076416
stussy stussy Classic printed zipper sweatshirt,长红贸易1.0,https://cnfair.com/detail/PI24030076418
NK fleece sweatshirt Vintage Mini Swoosh Travis Scott's same style fleece hoodie,长红贸易1.0,https://cnfair.com/detail/PI24030076419
"FOG multi-line ESSENTIALS pure cotton trousers for men and women, the same FOG high street fashion brand casual leggings sweatpants",原创潮流社,https://cnfair.com/detail/PI24030076420
ASRV fake two-piece fitness double-layer sports shorts men's American three-point basketball tights large size quick-drying lining,未织授权企业店,https://cnfair.com/detail/PI24030076421
FOG FEAR OF GOD double line ESSENTIALS American high street fashion brand loose casual round neck sweatshirt for men,原创潮流社,https://cnfair.com/detail/PI24030076424
"CRTZ Trucker Hat American trendy brand cruise ship printed sun protection truck hat for men, internet celebrity popular peaked cap for women",欧美潮牌帽子店,https://cnfair.com/detail/PI24030076425
Manufacturer's spring printing street real shot summer couple's clothing new Korean style men's and women's casual fashion short-sleeved loose half,晓晓批发56,https://cnfair.com/detail/PI24030076426
Fashion trend CL home English CE printed short-sleeved TEE hooded sweatshirt terry leggings sweatpants trousers for men and women,上海峄成电子商务有限公司,https://cnfair.com/detail/PI24030076427
"Men's bread coat vest, autumn and winter sleeveless down jacket, lightweight and warm, men's cotton vest, thick vest jacket, trendy",洛蔓塔旗舰店,https://cnfair.com/detail/PI24030076429
"FOG multi-line ESSENTIALS pure cotton trousers for men and women, the same FOG high street fashion brand casual leggings sweatpants",原创潮流社,https://cnfair.com/detail/PI24030076432
Fully enclosed non-adjustable hip-hop street dance embroidered sun protection baseball cap backward wearing size cap ny casual flat brim,外贸出口帽子批发,https://cnfair.com/detail/PI24030076433
GUCCI Peaked Cap Adjustable cap hiphop hip hop street dance hat mesh hat Versatile Korean style casual trendy hat bboy sun hat travel hat racing hat,鞋服帽业小店,https://cnfair.com/detail/PI24030076436
clothing,411AD092E6119FAA8C4EE75A42EB27AC,https://cnfair.com/detail/PI24030076437
apparel,411AD092E6119FAA8C4EE75A42EB27AC,https://cnfair.com/detail/PI24030076439
"CRTZ Trucker Hat American trendy brand cruise ship printed sun protection truck hat for men, internet celebrity popular peaked cap for women",欧美潮牌帽子店,https://cnfair.com/detail/PI24030076443
Foreign Trade Pants Wholesale Warriors Lakers 76ers Heat Raptors Magic Pocket Shorts Baseball Basketball Pants,莆田市城厢区朝汉服装店,https://cnfair.com/detail/PI24030076444
5-color hoodie of the year under the red and white small mark in the letter string 771401,tb1005773817的小店,https://cnfair.com/detail/PI24030076445
8-color knitted fabric health cloth can be used as cardigan and sweatshirt,好运布料行,https://cnfair.com/detail/PI24030076446
European and American niche rap trendy blue and white towel embroidered velvet hooded sweatshirt casual sports trousers,尖端潮流工作室,https://cnfair.com/detail/PI24030076447
Foreign Trade Pants Wholesale Warriors Lakers 76ers Heat Raptors Magic Pocket Shorts Baseball Basketball Pants,莆田市城厢区朝汉服装店,https://cnfair.com/detail/PI24030076453
Nike fleece sweatshirt Vintage Mini Swoosh Travis Scott's same style Nike fleece hoodie,长红贸易1.0,https://cnfair.com/detail/PI24030076457
Skateboard denim shorts washed classic denim shorts men's summer loose retro trendy brand solid color casual trousers,衣衣不舍时尚屋,https://cnfair.com/detail/PI24030076458
Foreign trade European and American style stars with the same label and cloth label big wool ball knitted wool warm hat for women in winter,义乌市俏俪服饰有限公司,https://cnfair.com/detail/PI24030076461
20FW patch embroidered LOGO hooded sweatshirt,PikaPikaGo,https://cnfair.com/detail/PI24030076462
Jacket,义乌市雄韬服饰有限公司,https://cnfair.com/detail/PI24030076468
Around the galaxy there are no brighter stars than you,把脉老中医,https://cnfair.com/detail/PI24030076469
Correct version of gallery dept hand-painted splashed ink stitching drawstring high street casual sweatpants slightly flared long pants for men,FFCP Studios,https://cnfair.com/detail/PI24030076470
P shorts black and white simple horizontal LOGO letters,chaos new,https://cnfair.com/detail/PI24030076471
2224#NK new embroidered velvet thickened round neck sweatshirt,长红贸易1.0,https://cnfair.com/detail/PI24030076472
New FOG multi-line ESSENTIALS reflective shorts men's quarter pants high street loose and same style for men and women,六安江左电子商务有限公司,https://cnfair.com/detail/PI24030076473
Fully enclosed non-adjustable hip-hop street dance embroidered sun protection baseball cap backward wearing size cap ny casual flat brim,外贸出口帽子批发,https://cnfair.com/detail/PI24030076475
"New men's knitted half-chest zipper pullover sweatshirt, comfortable and versatile",云端shop,https://cnfair.com/detail/PI24030076476
Chelsea Inter Milan Atletico Madrid Training Wear Football Wear Long Sleeve Main Suit Half Zip Jersey Wholesale Dropshipping,广州市隆广服饰商行,https://cnfair.com/detail/PI24030076485
Does Renqi have a small chest? ⑤ Color hoodie 3121314,花生收割机,https://cnfair.com/detail/PI24030076486
European and American trendy brand letter printed casual loose sweatshirt Y2K hip hop street men and women pullover tops jacket trendy ins,防弹少年团TRAPSTAR外贸服装店,https://cnfair.com/detail/PI24030076491
Unisex fashionable frayed baseball cap Hat brim length 7cm Hat girth adjustable 56-60cm,老王低调卖外贸【工厂店★一件代发】,https://cnfair.com/detail/PI24030076495
European and American trendy brand letter printed casual loose sweatshirt Y2K hip hop street men and women pullover tops jacket trendy ins,防弹少年团TRAPSTAR外贸服装店,https://cnfair.com/detail/PI24030076504
EE print shorts Printed logo Sweatpants mesh Drawstring American shorts,我需要神仙元2,https://cnfair.com/detail/PI24030076505
Summer new American sports shorts men's running quick-drying basketball training muscle fitness brothers double-layer three-point pants,Fitness Wolf官方店,https://cnfair.com/detail/PI24030076514
12 colors European and American RL classic solid color basic double-sided cloth retro heavy industry simple pony embroidery round neck sweatshirt,云端shop,https://cnfair.com/detail/PI24030076517
S warehouse LD301JX28463QTY,repcourier,https://cnfair.com/detail/PI24030076519
NK fleece sweatshirt Vintage Mini Swoosh Travis Scott's same style fleece hoodie,长红贸易1.0,https://cnfair.com/detail/PI24030076523
Big stubble front four-color knitted hat 881550,青春有可为,https://cnfair.com/detail/PI24030076532
"Full face zipper sweatshirt, one piece to make new cross-border sweatshirt",漫萌工坊,https://cnfair.com/detail/PI24030076534
Details new link to order! ! ! 【Fourteen Colors】Classic Hot Style Cross patch leather washed distressed jeans trousers Couple model for men and women,草帽出品【八点开拍】,https://cnfair.com/detail/PI24030076538
Front embroidery and back oil painting landscape beige sweatshirt 781801,tb1005773817的小店,https://cnfair.com/detail/PI24030076539
West Coast trendy shorts Ericemanuel EE American shorts men's sports casual plus size hip hop shorts,上饶市吉米电子商务有限公司,https://cnfair.com/detail/PI24030076540
apparel,茵密纯旗舰店,https://cnfair.com/detail/PI24030076541
apparel,茵密纯旗舰店,https://cnfair.com/detail/PI24030076542
apparel,茵密纯旗舰店,https://cnfair.com/detail/PI24030076543
apparel,茵密纯旗舰店,https://cnfair.com/detail/PI24030076544
apparel,茵密纯旗舰店,https://cnfair.com/detail/PI24030076545
sports Shorts Large size loose breathable knee length pants casual running pants fitness Aj23 basketball pants men's summer,街头篮球裤工厂店,https://cnfair.com/detail/PI24030076552
Front offset printed yellow rope/\four color shorts 831158,青春有可为,https://cnfair.com/detail/PI24030076554
CARHARTT WIP Kahart special attire casual trousers trendy brand washed multi-pockets retro straight drawstring feet,十岁的猫,https://cnfair.com/detail/PI24030076555
"F7 Men's golf shorts Quick-drying fabric shorts,Fabric composition: 85% polyester + 15% spandex",尚高优品外贸高尔夫服饰,https://cnfair.com/detail/PI24030076557
BF Internet celebrity style new solid color sweatshirt for men and women spring and autumn student casual Korean style fried street hooded plus velvet hoodie,奢耐文艺男 SHERNA,https://cnfair.com/detail/PI24030076560
European and American niche rap trendy blue and white towel embroidered velvet hooded sweatshirt casual sports trousers,尖端潮流工作室,https://cnfair.com/detail/PI24030076566
InSinkEasy light brown short sleeves on the chest 820357,husky-reps,https://cnfair.com/detail/PI24030076568
"European and American fashionable street brands for men and women, short-sleeved floral shirts with loose lapels, GD men's same style printed casual couple shirts, trendy",SYe家潮流服饰,https://cnfair.com/detail/PI24030076569
Balaclava Balaclava masked sand sculpture hat Syrian social black funny drill hood male,望北潮流1号店,https://cnfair.com/detail/PI24030076574
"Full face zipper sweatshirt, one piece to make new cross-border sweatshirt",漫萌工坊,https://cnfair.com/detail/PI24030076575
European and American trendy brand new boat-shaped print American high street hooded sweatshirt streetwear Harajuku sweatshirt couple jacket,防弹少年团TRAPSTAR外贸服装店,https://cnfair.com/detail/PI24030076578
American basketball shorts men's training fitness sports pants summer running lining quick-drying double-layer mid-pants tights,大运服饰,https://cnfair.com/detail/PI24030076579
"summer benefits,Breathable, sweat-proof, comfortable and quick-drying short sleeves,Basketball warm-up training clothes",C位出道,https://cnfair.com/detail/PI24030076594
Chest embroidery ⑧ color POLO shirt 721115,花生收割机,https://cnfair.com/detail/PI24030076598
2023112512#好,鸥媄镐接,https://cnfair.com/detail/PI24030076600
Chelsea Inter Milan Atletico Madrid Training Wear Football Wear Long Sleeve Main Suit Half Zip Jersey Wholesale Dropshipping,广州市隆广服饰商行,https://cnfair.com/detail/PI24030076603
805 Spot Spring and Autumn Men's New Wear-Resistant Laminated Zipper Air Layer Cotton Sports Pants Leg-Resizing Casual Pants 163,祥子外贸66666,https://cnfair.com/detail/PI24030076611
apparel,411AD092E6119FAA8C4EE75A42EB27AC,https://cnfair.com/detail/PI24030076617
GALLERY DEPT splash-ink graffiti micro-horn structure splicing casual loose jeans long pants men and women trendy,FFCP Studios,https://cnfair.com/detail/PI24030076618
KE long tube three pairs--Lsize,VSocks,https://cnfair.com/detail/PI24030076619
KE long tube three pairs--Lsize,VSocks,https://cnfair.com/detail/PI24030076620
KE long tube three pairs--Lsize,VSocks,https://cnfair.com/detail/PI24030076621
FEAR OF GOD ESSENTIALS multi-thread FOG zipper cardigan sweatshirt high street hooded plus fleece jacket tide,农村人卖潮牌,https://cnfair.com/detail/PI24030076636
revenge embroidered logo straight jeans high street trendy trousers loose casual pants for men students teenagers,农村人卖潮牌,https://cnfair.com/detail/PI24030076637
revenge embroidered logo straight jeans high street trendy trousers loose casual pants for men students teenagers,农村人卖潮牌,https://cnfair.com/detail/PI24030076638
Fully enclosed non-adjustable hip-hop street dance embroidered sun protection baseball cap backward wearing size cap ny casual flat brim,外贸出口帽子批发,https://cnfair.com/detail/PI24030076646
"FOG multi-line ESSENTIALS pure cotton trousers for men and women, the same FOG high street fashion brand casual leggings sweatpants",原创潮流社,https://cnfair.com/detail/PI24030076649
Ice silk hood outdoor summer sun protection cycling scarf for men and women fishing mask covering face windproof camouflage hood,军酷旅户外,https://cnfair.com/detail/PI24030076653
apparel,411AD092E6119FAA8C4EE75A42EB27AC,https://cnfair.com/detail/PI24030076657
