clothing,411AD092E6119FAA8C4EE75A42EB27AC,https://cnfair.com/detail/PI24030085816
GUCCI Peaked Cap New adjustable cap baseball hat Men's and women's versatile sun hats and peaked caps hiphop hip hop hat Hong Kong style casual hat travel trend hat,鞋服帽业小店,https://cnfair.com/detail/PI24030085817
Ice silk hood outdoor summer sun protection cycling scarf for men and women fishing mask covering face windproof camouflage hood,军酷旅户外,https://cnfair.com/detail/PI24030085818
Spot goods I LOVE ATL Atlanta limited edition AK fashionable hooded sweatshirt Playboi Same style as Carti,Sicko1993,https://cnfair.com/detail/PI24030085821
EE print shorts Printed logo Sweatpants mesh Drawstring American shorts,我需要神仙元2,https://cnfair.com/detail/PI24030085822
Palm Palm Angels large letter printed hooded sweatshirt on the back loose casual men's and women's trendy hoodie,卓木凡CC,https://cnfair.com/detail/PI24030085824
original corteiz crtw logo towel socks cruise ship socks golf color little monster,Baymax(CND),https://cnfair.com/detail/PI24030085826
202310173#leopard,位莱福士,https://cnfair.com/detail/PI24030085829
8-color knitted fabric health cloth can be used as cardigan and sweatshirt,好运布料行,https://cnfair.com/detail/PI24030085834
Leg-locking sweatpants high street trousers pure cotton casual couple,TER——P,https://cnfair.com/detail/PI24030085835
apparel,411AD092E6119FAA8C4EE75A42EB27AC,https://cnfair.com/detail/PI24030085093
apparel,411AD092E6119FAA8C4EE75A42EB27AC,https://cnfair.com/detail/PI24030085093
Professional customized light plate breathable training and competition football uniforms for adults short-sleeved quick-drying blind box numbered football jerseys,六六体育用品工厂店,https://cnfair.com/detail/PI24030085101
FLA ALYX co-branded Playboicartl Ken Carson album limited short-sleeved T-shirt summer fashion,FLANEUR ATELIER,https://cnfair.com/detail/PI24030085102
FLA independent CPFM co-branded S CACTUS HEART TEE short-sleeved T-shirt loose round neck summer half-sleeved high street,FLANEUR ATELIER,https://cnfair.com/detail/PI24030085106
"Pink wide-leg overalls for women, loose-fitting casual hottie American street casual straight-leg street sweatpants for women",深圳市宝安区福永诗如嫣服饰商行,https://cnfair.com/detail/PI24030085109
sports Shorts Large size loose breathable knee length pants casual running pants fitness Aj23 basketball pants men's summer,街头篮球裤工厂店,https://cnfair.com/detail/PI24030084000
113,411AD092E6119FAA8C4EE75A42EB27AC,https://cnfair.com/detail/PI24030084001
Korean version BF Harajuku style short-sleeved loose baseball uniform hip-hop street dance hiphop T-shirt top vintage men and women summer,原宿潮衣库,https://cnfair.com/detail/PI24030084003
VLONE loose T-shirt Wang Yibo's same style oversize male and female couples European and American joint limited edition big V short sleeves,FFCP Studios,https://cnfair.com/detail/PI24030084004
Hook socks colorful socks candy men and women couples trendy running sports socks breathable basketball socks large hook socks,那家宝贝精品店,https://cnfair.com/detail/PI24030084007
Hook socks colorful socks candy men and women couples trendy running sports socks breathable basketball socks large hook socks,那家宝贝精品店,https://cnfair.com/detail/PI24030084008
ANGEL KING European and American high street LA Los Angeles Lakers basketball shorts,ANGELKING47,https://cnfair.com/detail/PI24030084012
CARHARTT WIP Kahart special clothing trendy brand graffiti square letter print loose casual short-sleeved T-shirt,十岁的猫,https://cnfair.com/detail/PI24030084014
Pants,411AD092E6119FAA8C4EE75A42EB27AC,https://cnfair.com/detail/PI24030084015
Pants,411AD092E6119FAA8C4EE75A42EB27AC,https://cnfair.com/detail/PI24030084016
"Trendy brand men's boxer briefs, sexy pure boxer briefs, loose, breathable, fashionable European and American sports student shorts for men",萧炎学长内内店,https://cnfair.com/detail/PI24030084018
【Sneaker peripheral products】NK Ad sports socks Macaron Tie dye series New colors will be added gradually Warehousing‼ ️‼ ️‼ ️(Agent can take photos as gifts Single shots will not be shipped⚠️⚠️No after-sales service),路人甲,https://cnfair.com/detail/PI24030084242
【Sneaker peripheral products】NK Ad sports socks Macaron Tie dye series New colors will be added gradually Warehousing‼ ️‼ ️‼ ️(Agent can take photos as gifts Single shots will not be shipped⚠️⚠️No after-sales service),路人甲,https://cnfair.com/detail/PI24030084243
【Sneaker peripheral products】NK Ad sports socks Macaron Tie dye series New colors will be added gradually Warehousing‼ ️‼ ️‼ ️(Agent can take photos as gifts Single shots will not be shipped⚠️⚠️No after-sales service),路人甲,https://cnfair.com/detail/PI24030084244
【Sneaker peripheral products】NK Ad sports socks Macaron Tie dye series New colors will be added gradually Warehousing‼ ️‼ ️‼ ️(Agent can take photos as gifts Single shots will not be shipped⚠️⚠️No after-sales service),路人甲,https://cnfair.com/detail/PI24030084245
【Sneaker peripheral products】NK Ad sports socks Macaron Tie dye series New colors will be added gradually Warehousing‼ ️‼ ️‼ ️(Agent can take photos as gifts Single shots will not be shipped⚠️⚠️No after-sales service),路人甲,https://cnfair.com/detail/PI24030084246
【Sneaker peripheral products】NK Ad sports socks Macaron Tie dye series New colors will be added gradually Warehousing‼ ️‼ ️‼ ️(Agent can take photos as gifts Single shots will not be shipped⚠️⚠️No after-sales service),路人甲,https://cnfair.com/detail/PI24030084247
【Sneaker peripheral products】NK Ad sports socks Macaron Tie dye series New colors will be added gradually Warehousing‼ ️‼ ️‼ ️(Agent can take photos as gifts Single shots will not be shipped⚠️⚠️No after-sales service),路人甲,https://cnfair.com/detail/PI24030084248
【Sneaker peripheral products】NK Ad sports socks Macaron Tie dye series New colors will be added gradually Warehousing‼ ️‼ ️‼ ️(Agent can take photos as gifts Single shots will not be shipped⚠️⚠️No after-sales service),路人甲,https://cnfair.com/detail/PI24030084249
【Sneaker peripheral products】NK Ad sports socks Macaron Tie dye series New colors will be added gradually Warehousing‼ ️‼ ️‼ ️(Agent can take photos as gifts Single shots will not be shipped⚠️⚠️No after-sales service),路人甲,https://cnfair.com/detail/PI24030084250
【Sneaker peripheral products】NK Ad sports socks Macaron Tie dye series New colors will be added gradually Warehousing‼ ️‼ ️‼ ️(Agent can take photos as gifts Single shots will not be shipped⚠️⚠️No after-sales service),路人甲,https://cnfair.com/detail/PI24030084251
Summer Slim Render Short Top Sexy Women Sleeveless O Croptop,Lixintong,https://cnfair.com/detail/PI24030084252
yeezy season Calabasas socks sock Same style as Kanye,VSocks,https://cnfair.com/detail/PI24030084253
"The whole network is drunk｜One card, three pairs of NK cabinet original single men's and women's sports socks boat socks, versatile for all seasons, classic pure cotton socks",大咖 （正常发货）,https://cnfair.com/detail/PI24030084254
1,411AD092E6119FAA8C4EE75A42EB27AC,https://cnfair.com/detail/PI24030084255
"Hats suitable for round faces for women, trendy Korean style baseball caps with lettering, embroidery, versatile and handsome peaked caps, ins trendy brand for men",欧美潮牌帽子店,https://cnfair.com/detail/PI24030084262
"Hook socks, men's anti-odor socks, mid-length socks, spring and summer students' breathable sports basketball socks, girls' couple socks",茵密纯旗舰店,https://cnfair.com/detail/PI24030084266
"Hook socks, men's anti-odor socks, mid-length socks, spring and summer students' breathable sports basketball socks, girls' couple socks",茵密纯旗舰店,https://cnfair.com/detail/PI24030084267
"Hook socks, men's anti-odor socks, mid-length socks, spring and summer students' breathable sports basketball socks, girls' couple socks",茵密纯旗舰店,https://cnfair.com/detail/PI24030084268
"Hook socks, men's anti-odor socks, mid-length socks, spring and summer students' breathable sports basketball socks, girls' couple socks",茵密纯旗舰店,https://cnfair.com/detail/PI24030084269
"Hook socks, men's anti-odor socks, mid-length socks, spring and summer students' breathable sports basketball socks, girls' couple socks",茵密纯旗舰店,https://cnfair.com/detail/PI24030084270
Fragment x Pokemon Pikachu co-branded T-shirt Pokemon Pokemon Hiroshi Fujiwara X trendy brand short sleeves,亲因缘旗舰店,https://cnfair.com/detail/PI24030084272
1,411AD092E6119FAA8C4EE75A42EB27AC,https://cnfair.com/detail/PI24030084280
"FOG multi-line ESSENTIALS pure cotton trousers for men and women, the same FOG high street fashion brand casual leggings sweatpants",原创潮流社,https://cnfair.com/detail/PI24030084297
instunning European and American retro satin suspender dress women's summer slim waist printed lace long skirt,INSTUNNING,https://cnfair.com/detail/PI24030084299
240g double yarn pure cotton G home short-sleeved T-shirt,NIROU霓柔,https://cnfair.com/detail/PI24030085001
ASRV sports shorts men's American quick-drying five-point pants outdoor running training double-layer basketball pants professional fitness pants,MuscleBoy企业店,https://cnfair.com/detail/PI24030085002
High Street Situs hip-hop sweatshirt for men 2023 new autumn and winter velvet thickened hooded trendy handsome loose teenagers,潮流时尚馆V,https://cnfair.com/detail/PI24030085009
Revenge Embroidered jeans Thousand needle embroidery jeans classic black high street style xxx classic,FFCP Studios,https://cnfair.com/detail/PI24030085010
"Autumn and winter velvet men's work clothes, stain-resistant and wear-resistant hooded cardigan sweatshirt for construction workers at construction sites",新亨文艺男,https://cnfair.com/detail/PI24030085011
Cross-border foreign trade Trapstar rainbow letter gradient towel embroidery short-sleeved T-shirt fog high street shorts suit,广州奕辰国际贸易商行,https://cnfair.com/detail/PI24030085013
Cross-border foreign trade Trapstar rainbow letter gradient towel embroidery short-sleeved T-shirt fog high street shorts suit,广州奕辰国际贸易商行,https://cnfair.com/detail/PI24030085014
I'm not trendy GALLERY DEPT GD FOG high street retro old god printed loose round neck short-sleeved T-shirt,我不潮我很干燥,https://cnfair.com/detail/PI24030085015
apparel,411AD092E6119FAA8C4EE75A42EB27AC,https://cnfair.com/detail/PI24030085016
Sweater Casual Knit Long Sleeve Turtleneck Solid Color women's clothing,Happy shopping orange,https://cnfair.com/detail/PI24030085020
Sweater Casual Knit Long Sleeve Turtleneck Solid Color women's clothing,Happy shopping orange,https://cnfair.com/detail/PI24030085021
"New men's knitted half-chest zipper pullover sweatshirt, comfortable and versatile",云端shop,https://cnfair.com/detail/PI24030085022
PRO high-elastic sports tight clothes men's long-sleeved short-sleeved quick-drying T-shirt running fitness basketball training bottoming cut sleeves,堂俊金服饰店,https://cnfair.com/detail/PI24030085024
"New cross-border hot selling Crocs for men and women, celebrity same style flat beach shoes 10001 home sandals",深圳市罗湖区昌国鑫贸易商行,https://cnfair.com/detail/PI24030085025
European and American trendy brand palm tree letter print logo loose short-sleeved T-shirt for men and women Leisure,广州鸿允商贸有限公司,https://cnfair.com/detail/PI24030085027
Coconut tree multi-color love block letters 4-color short sleeves WE 2170#,点点小牙签,https://cnfair.com/detail/PI24030085030
Stussy Stussy short-sleeved T-shirt high quality new world tour dice billiards new couple tops trendy,广州贝恩服饰商行,https://cnfair.com/detail/PI24030085032
Armani,杏帘在望,https://cnfair.com/detail/PI24030085040
vibe god pants B136 dark brown washed distressed double knee canvas overalls logging pants kenijima,东殿川 阿光一号,https://cnfair.com/detail/PI24030085041
"Trendy brand men's boxer briefs, sexy pure boxer briefs, loose, breathable, fashionable European and American sports student shorts for men",萧炎学长内内店,https://cnfair.com/detail/PI24030085042
1,411AD092E6119FAA8C4EE75A42EB27AC,https://cnfair.com/detail/PI24030085043
12,411AD092E6119FAA8C4EE75A42EB27AC,https://cnfair.com/detail/PI24030085048
"Summer 2023 new style outer wear sandals with slippers for men and women, thick-soled flip-flops for couples, student fashion beach shoes",二叔潮店,https://cnfair.com/detail/PI24030085049
"Blind box fans player jersey Barcelona, Assern and Liman connect with Paris Messi Cristiano Ronaldo football clothes",世界杯球衣店,https://cnfair.com/detail/PI24030085052
"EE American fitness shorts, muscular men's sports quarter pants, American muscle casual sweat-wicking casual street running",Musclemania官方店,https://cnfair.com/detail/PI24030085056
"EE American fitness shorts, muscular men's sports quarter pants, American muscle casual sweat-wicking casual street running",Musclemania官方店,https://cnfair.com/detail/PI24030085057
NK fleece sweatshirt Vintage Mini Swoosh Travis Scott's same style fleece hoodie,长红贸易1.0,https://cnfair.com/detail/PI24030085059
clothing,411AD092E6119FAA8C4EE75A42EB27AC,https://cnfair.com/detail/PI24030085060
1,411AD092E6119FAA8C4EE75A42EB27AC,https://cnfair.com/detail/PI24030085062
Manufacturer in stock wholesale new knitted hats for men and women in autumn and winter brand hats European and American cross-border pullover woolen hats cold hats,广州市时代帽业商行,https://cnfair.com/detail/PI24030085067
apparel,411AD092E6119FAA8C4EE75A42EB27AC,https://cnfair.com/detail/PI24030085068
Summer breathable basketball shorts Lakers Nets Warriors shorts Irving Kobe running sports quick-drying five-point pants trendy,百跃鞋服批发贸易,https://cnfair.com/detail/PI24030085073
Corteiz Alcatraz European and American y2k niche street loose female beauty fashion hip-hop skateboard casual sweatshirt suit,欧美服饰印花店Shopping apparel T Shirt sweater,https://cnfair.com/detail/PI24030085074
2324 Miami International Messi No. 10 Football Jersey Ajax Paris Real Madrid France Brazil United States Short Sleeve,深圳半颗柠檬体育服饰用品,https://cnfair.com/detail/PI24030085077
VLONE FOG summer loose T-shirt American high street style couple European and American joint limited edition big V short-sleeved men and women ins,FFCP Studios,https://cnfair.com/detail/PI24030085085
12,411AD092E6119FAA8C4EE75A42EB27AC,https://cnfair.com/detail/PI24030085086
Amazon’s hottest mea culpa jacquard knitted hat Y2k men and women hip hop autumn and winter warm woolen hat cold hat,天空之尘的小店,https://cnfair.com/detail/PI24030085088
8-color knitted fabric health cloth can be used as cardigan and sweatshirt,好运布料行,https://cnfair.com/detail/PI24030085089
tykuu,411AD092E6119FAA8C4EE75A42EB27AC,https://cnfair.com/detail/PI24030085092
apparel,411AD092E6119FAA8C4EE75A42EB27AC,https://cnfair.com/detail/PI24030085093
Apeman head patent leather series low-top casual sneakers,TJ球鞋/只更新天花板,https://cnfair.com/detail/PI24030011198
[Special offer/non-refundable] Air Jordan 11(AJ11),A1顶级 新店搜索DB MADE,https://cnfair.com/detail/PI24030011206
2023 Autumn New Sports Canvas Trendy Shoes Men's Mesh Shoes Trendy Coconut Men's Shoes Versatile Casual Shoes Cloth Shoes,雪云轩旗舰店,https://cnfair.com/detail/PI24030011239
KX AJ1 Creuset cool color French cast iron enamel health pot rice ax stew kitchen household rice kettle Japanese style 30+ colors Inventory is temporarily sufficient‼ ️‼ ️‼ ️,Sneaker King,https://cnfair.com/detail/PI24030011241
[Vietnam VT version Big special offer benefits 】Nk Dunk Low 11 colors 618 major benefits are launched,想当个慈善家,https://cnfair.com/detail/PI24030011254
"Coconut large size 46 slippers for women to wear outside, slide thick-soled couples summer non-slip slippers for men",唐德男鞋店,https://cnfair.com/detail/PI24030011257
"Orders placed by friends,The most cost-effective in the market ""Supports normal after-sales service""",Uzi,https://cnfair.com/detail/PI24030011273
pure original version air force white low top Independent mold opening 35.5~47.5 is the only one on the market,静水流深,https://cnfair.com/detail/PI24030011285
Putian TN foreign trade air-cushion shoes 40-46 cross-border foreign trade men's shoes for couples Putian sports shoes 017 models sincerely recruit foreign trade,深圳市宝安区莆顺哒鞋厂,https://cnfair.com/detail/PI24030011292
"Trendy brand ornaments, hand-made dolls, trendy toys, trendy building blocks, violent bears, sz-sujiao-kaws dolls in stock",专注潮流工作室,https://cnfair.com/detail/PI24030011299
NEW BALANCE new Balance 530,A1顶级 新店搜索DB MADE,https://cnfair.com/detail/PI24030011304
"Ts Barb/US Order The factory was attacked by pigeons,Special deal,The original price is more than 260",匿名人,https://cnfair.com/detail/PI24030011326
SKEPTA x MAX TAILWIND artist joint air cushion running shoes CQ8714 CU1706,红黑商贸,https://cnfair.com/detail/PI24030011334
【Special Offer】Adidas Harden Vol.7 Harden 7th generation basketball shoes Really explosive version,小林户外运动店篮球鞋跑鞋休闲鞋,https://cnfair.com/detail/PI24030011342
t-shirt,Autismss宝藏屋,https://cnfair.com/detail/PI24030011349
New versatile trendy casual sports shoes DUNK sb 247-345,PANDA SHOES,https://cnfair.com/detail/PI24030011354
Jordan 1 Retro High OG Patent Bred | 555088-063,Budgetshoes,https://cnfair.com/detail/PI24030011357
Special edition N1ke Air Force 1 Low Acceptable returns and exchanges for quality issues,Budgetshoes,https://cnfair.com/detail/PI24030011373
Harbor City kaws doll trendy toy figure Kos face covering Star Wars Sesame Street large doll living room desktop decoration,果冻潮玩,https://cnfair.com/detail/PI24030011374
【GT version】Nk Dunk series,想当个慈善家,https://cnfair.com/detail/PI24030011384
VT version SB Dunk/Ts AJ1 Low series Exclusively available sizes: Us3.5-Us14/Eu35.5-Eu48.5,7up,https://cnfair.com/detail/PI24030011396
"Coconut large size 46 slippers for women to wear outside, slide thick-soled couples summer non-slip slippers for men",唐德男鞋店,https://cnfair.com/detail/PI24030011403
Corteiz Anatomy shoes Please do not place orders from different customers together.,umkao,https://cnfair.com/detail/PI24030011419
"Wan produced pure original AJ1 Creuset cool color French cast iron enamel health pot rice ax stew kitchen household rice kettle Japanese style 30+ colors Inventory is temporarily sufficient‼ ️‼ ️‼ ️Link No. 1🔗(If you can’t find the color, go to link No. 2)",路人甲,https://cnfair.com/detail/PI24030011432
trendy fun Tricolor About 28cm high sit on a stool Face covering XX Kaws Hand model Ornament gift figures,深圳市福田区世海动漫玩具商行,https://cnfair.com/detail/PI24030011457
H36 N1ke Dunk Low Vintage Green=DQ8580-100,CNFactory,https://cnfair.com/detail/PI24030011465
Yeezy Slide slippers,TJ球鞋/只更新天花板,https://cnfair.com/detail/PI24030011471
"Birkenstock half slippers, thick-soled Birkenstock toe-cap sandals, women's outer wear, lazy leather cork half slippers, Birkenstock shoes",惠州市简悦鞋业有限公司,https://cnfair.com/detail/PI24030011480
NK AF1 Low &#39;07 Black Black 315122-001,Budgetshoes,https://cnfair.com/detail/PI24030011485
H36CN NB 2002R Protection Pack Phantom-M2002RDB,CNFactory2,https://cnfair.com/detail/PI24030011498
NK AF1 Low,Budgetshoes,https://cnfair.com/detail/PI24030011507
Wholesale Putian Men's and women's shoes Air Force One pure white classic low top small white shoes high AF1 casual couple sneakers,东莞市虎门大发仔鞋服商行,https://cnfair.com/detail/PI24030011514
[There is no better quality Korean order on the market] Clover Campus 00S men's and women's same style retro casual sneakers,TJ球鞋/只更新天花板,https://cnfair.com/detail/PI24030011520
VT version SB Dunk/Ts AJ1 Low series Exclusively available sizes: Us3.5-Us14/Eu35.5-Eu48.5,7up,https://cnfair.com/detail/PI24030011529
Putian TN foreign trade air-cushion shoes 40-46 cross-border foreign trade men's shoes for couples Putian sports shoes 017 models sincerely recruit foreign trade,深圳市宝安区莆顺哒鞋厂,https://cnfair.com/detail/PI24030016260
shoe,金鼎名品鞋店,https://cnfair.com/detail/PI24030016262
"Brand Putian NK high-quality dunksb same style for men and women, versatile low-cut student couple shoes, round-toe trendy casual skate shoes, skateboard shoes",古斯特运动用品企业店,https://cnfair.com/detail/PI24030016265
"Salehe joint fingerprint clogs for men and women, casual beach shoes, fashionable toe-toe sandals and slippers for outer wear wholesale",深圳市罗湖区昌国鑫贸易商行,https://cnfair.com/detail/PI24030016275
Edison Chen slippers summer trendy brand trendy slippers for couples men and women casual sandals Fujiwara Hiroshi fashion trend beach slippers,足导潮流8,https://cnfair.com/detail/PI24030016281
Putian TN foreign trade air-cushion shoes 40-46 cross-border foreign trade men's shoes for couples Putian sports shoes 017 models sincerely recruit foreign trade,深圳市宝安区莆顺哒鞋厂,https://cnfair.com/detail/PI24030016295
Full head layer blue base ADIDAS Superstar Adidas classic Gold label shell head Made of full-grain calfskin EVA original blue background,井川里予,https://cnfair.com/detail/PI24030016296
Nike Air Max95OG air cushion running shoes AO2450-001 AT2865-200 307960-114,名鞋汇,https://cnfair.com/detail/PI24030016305
[Special offer/non-refundable] Coconut Yeezy 350,A1顶级 新店搜索DB MADE,https://cnfair.com/detail/PI24030016309
"WTG pure original version special price AJ6 multi-color Original factory price 300➕ top layer Latex insoles,This item will be removed from the shelves at any time!",静水流深,https://cnfair.com/detail/PI24030016313
"【 Boost is really explosive 1:1 raw material Yeezy700] The whole order is all brand new and in perfect condition, original box, not out of stock, suede top layer suede.",红红在努力,https://cnfair.com/detail/PI24030016323
M version DUNK/SB DUNK,A1顶级 新店搜索DB MADE,https://cnfair.com/detail/PI24030016327
Coconut 350 Large Size 46 Men's Shoes Black Angel Spring Flying Weave Breathable Black Sports Shoes Summer Style Putian Gypsophila,omasculin旗舰店,https://cnfair.com/detail/PI24030016328
Authentic cork slippers Germany Arizona double buckle men's and women's beach shoes sandals outdoor slippers four-season universal shoes,德国软木拖鞋,https://cnfair.com/detail/PI24030016335
YEEZY SLIDE slippers (It is recommended to buy 2 sizes larger),A1顶级 新店搜索DB MADE,https://cnfair.com/detail/PI24030016342
"Running shoes, autumn and winter new couple sports shoes, fashionable, comfortable and lightweight shoes, casual shoes, dad shoes, running shoes, trendy",广州珂璐琪鞋业有限公司,https://cnfair.com/detail/PI24030016343
Yeezy Slide slippers,TJ球鞋/只更新天花板,https://cnfair.com/detail/PI24030016347
"2022 Xia Xinjia European and American trendy men's slippers, fashionable printed cloth Velcro casual slip-on slippers for outdoor beach",鞋酱大叔潮男鞋,https://cnfair.com/detail/PI24030016359
Putian TN foreign trade air-cushion shoes 40-46 cross-border foreign trade men's shoes for couples Putian sports shoes 017 models sincerely recruit foreign trade,深圳市宝安区莆顺哒鞋厂,https://cnfair.com/detail/PI24030016364
VT/Shen Batch Dunk,7up,https://cnfair.com/detail/PI24030016366
Essentials three-dimensional letter print velvet hooded sweatshirt FOG men's and women's youth street hip-hop jacket,原创潮流社,https://cnfair.com/detail/PI24030016370
Coconut slippers that feel like stepping on shit for men and women in summer outer wear SLIDE thick-soled heightening home couple anti-slip beach YEEZY,知一 Groovy,https://cnfair.com/detail/PI24030016387
Putian TN foreign trade air-cushion shoes 40-46 cross-border foreign trade men's shoes for couples Putian sports shoes 017 models sincerely recruit foreign trade,深圳市宝安区莆顺哒鞋厂,https://cnfair.com/detail/PI24030016391
VT Batch AJ4 Black Cat (2020),Discount Club,https://cnfair.com/detail/PI24030016967
BAPESTA SK8 DUNK couple niche sneakers men's autumn vibe meteor shoes casual sports moral training trendy shoes,光杆司令鞋类旗舰店,https://cnfair.com/detail/PI24030016968
New Trapstar black short hooded cotton coat winter original warm clothing retro high street fashion brand,广州市美瑛祺贸易有限公司,https://cnfair.com/detail/PI24030016973
Putian shoes AJ4 Red and blue mandarin duck co-branded white sail hot lava Paris non-slip wear-resistant versatile sports basketball shoes,深圳市宝安区莆顺哒鞋厂,https://cnfair.com/detail/PI24030016976
[Anniversary 10% off ends on April 25th] [Collection 1] Boost Yeezy Coconut 350v2 Gypsophila Angel ice cream burlap cream zebra BASF black and white gray orange taillight Oxidation Angel,Mimi商城,https://cnfair.com/detail/PI24030016989
2022 Summer Treading Coconut Slippers for Men yeezy slides couple casual outer wear non-slip thick-soled sandals,新三晖网络鞋商行,https://cnfair.com/detail/PI24030016993
