clothing,411AD092E6119FAA8C4EE75A42EB27AC,https://cnfair.com/detail/PI24030085816
Angel trousers rainbow striped webbing jacket letter suit school uniform jacket webbing casual pants foreign trade,广州奕程贸易有限公司,https://cnfair.com/detail/PI24030077234
European and American high street vibe style pants black and white cross destroyed raw edge hiphop bombed street micro-flared jeans for men,揭阳市揭东区锡场镇尚蔓电子商务经营部,https://cnfair.com/detail/PI24030077236
EE American muscle shorts casual fitness quick-drying men's sports quarter pants mesh breathable large version running street,Musclemania官方店,https://cnfair.com/detail/PI24030077237
"Autumn and winter polar fleece fleece gloves to keep warm and cold-proof, outdoor windproof and waterproof skiing, riding and driving touch screen gloves",Timor提莫手套,https://cnfair.com/detail/PI24030077238
corteiz American multi-pocket printed black overalls men's trendy street loose straight drawstring long pants,MR潮牌小店,https://cnfair.com/detail/PI24030077241
North Face Outdoor Men's GTX Waterproof Jacket Windbreaker 1898 color black Size M-4xl,小兔子外贸,https://cnfair.com/detail/PI24030077258
2023 cross-border fashion brand new product chest cuff LOGO hot stamping couple hoodie fashionable sweatshirt for men and women,上饶市禾航服饰有限公司,https://cnfair.com/detail/PI24030077259
EE print shorts Printed logo Sweatpants mesh Drawstring American shorts,我需要神仙元2,https://cnfair.com/detail/PI24030077266
AM European men's jeans with hole patch embroidered five-pointed star trendy elastic slim-fitting small-leg pants high-end men's pants,云韵天然风服饰,https://cnfair.com/detail/PI24030077267
Fully enclosed non-adjustable hip-hop street dance embroidered sun protection baseball cap backward wearing size cap ny casual flat brim,外贸出口帽子批发,https://cnfair.com/detail/PI24030077269
Amazon’s hottest mea culpa jacquard knitted hat Y2k men and women hip hop autumn and winter warm woolen hat cold hat,天空之尘的小店,https://cnfair.com/detail/PI24030077270
European and American West Coast trendy brand Eric Emanuel EE Shorts Summer Boys Sports Breathable Mesh Pants,宁波星航服饰有限公司,https://cnfair.com/detail/PI24030077272
Carhartt corduroy autumn and winter overalls casual pants straight pants couple trend loose men and women,Carhartt卡哈特实体潮流店,https://cnfair.com/detail/PI24030077275
8-color knitted fabric health cloth can be used as cardigan and sweatshirt,好运布料行,https://cnfair.com/detail/PI24030077278
Hip-hop V personalized embroidered teardrop three-hole hat winter warm knitted head hat for men and women outdoor cycling cold protection mask,花生酱周边,https://cnfair.com/detail/PI24030077279
Wholesale trendy brand star same style palm angel decapitated bear printed short-sleeved t-shirts for men and women couples loose half-sleeved,广州物潮服装商行,https://cnfair.com/detail/PI24030077281
8-color knitted fabric health cloth can be used as cardigan and sweatshirt,好运布料行,https://cnfair.com/detail/PI24030077282
Trendy brand shark camouflage zipper sweatshirt for young men and women trendy personality hoodie street hip-hop student clothes jacket,木子潮品168,https://cnfair.com/detail/PI24030077283
Suit cross-border sports men's spring and autumn air layer cotton knitted hooded zipper shirt sports casual jacket sweatpants,队长这里供销社 性比价神店,https://cnfair.com/detail/PI24030077287
New American the mountain Blue Peace Squirrel Quick Dry Short Sleeve Crew Neck 3D t-shirt,图漫,https://cnfair.com/detail/PI24030077298
"20SS angel shorts Rainbow straight fashion side striped casual pants for men and women, three-quarter pants trendy",广州奕程贸易有限公司,https://cnfair.com/detail/PI24030077300
Badge left arm square sight three-color sweatshirt trendy,鸥媄镐接,https://cnfair.com/detail/PI24030077307
stu logo Embroidery beanie Embroidered letter cold hat knitted hat two-fold hat woolen hat melon skin hat cm,戴头盔的谢腾飞有货就发没货退款,https://cnfair.com/detail/PI24030077310
Carhartt replacement B136 Moss green color canvas overalls Lumberjack knee patch casual pants for men and women B01 logging pants yol,赵哥外贸工作室,https://cnfair.com/detail/PI24030077311
EE print shorts Printed logo Sweatpants mesh Drawstring American shorts,我需要神仙元2,https://cnfair.com/detail/PI24030077312
clothing,8f68f8da15b555ce0c5baa6c0d6b6a28,https://cnfair.com/detail/PI24030077319
1,C1CDA5A182FAACD3D707BD4A4571DF25,https://cnfair.com/detail/PI24030077320
"New Korean style woolen hat, trendy men's pullover, elegant cross embroidered horseshoe ch knitted hat, autumn and winter women's warm",HAKESON帽业,https://cnfair.com/detail/PI24030077323
FEAR OF GOD multi-line ESSENTIALS reflective letter printing FOG men's and women's same style pure cotton casual shorts,农村人卖潮牌,https://cnfair.com/detail/PI24030077331
Spring and autumn new style casual sports air layer diagonal zipper multi-stitching 13-color leg 163 sweatpants,常熟市莫城街道衣点衣滴服饰商行,https://cnfair.com/detail/PI24030077333
[Loss money to win] Jerry's same style CPFM reborn foam letter print autumn and winter velvet hooded sweatshirt trendy,农村人卖潮牌,https://cnfair.com/detail/PI24030077335
fear of god FOG 19ss essentials logo mesh shorts ess letter print basic style beautiful high-street mesh breathable quick-drying drawstring black gray beige shorts three-quarter pants large pants gg,戴头盔的谢腾飞有货就发没货退款,https://cnfair.com/detail/PI24030077337
NOCTA GOLF co-branded drake autumn and winter new loose casual jacket hooded pullover sweatshirt and sweatpants suit,73 Studio,https://cnfair.com/detail/PI24030077340
Classic Ape Man Harajuku Shark Head Camouflage Zipper Sweater Loose Cotton Hooded Cardigan Jacket for Men and Women Couples,猿人壹號店,https://cnfair.com/detail/PI24030077344
Pants,411AD092E6119FAA8C4EE75A42EB27AC,https://cnfair.com/detail/PI24030077345
European and American trendy brand letter printed casual loose sweatshirt Y2K hip hop street men and women pullover tops jacket trendy ins,防弹少年团TRAPSTAR外贸服装店,https://cnfair.com/detail/PI24030077346
CARHARTT WIP workwear trendy brand Detroit denim jacket canvas washed distressed retro retro for men and women,十岁的猫,https://cnfair.com/detail/PI24030077351
European and American street fashion new shark tiger color matching double hooded jacket young men and women personalized cardigan hooded sweatshirt,木子潮品168,https://cnfair.com/detail/PI24030077366
hat,411AD092E6119FAA8C4EE75A42EB27AC,https://cnfair.com/detail/PI24030077367
Manufacturer in stock wholesale new knitted hats for men and women in autumn and winter brand hats European and American cross-border pullover woolen hats cold hats,广州市时代帽业商行,https://cnfair.com/detail/PI24030077375
Corteiz Printed ship sweatpants casual UK drip fit shorts Trendy shorts for men and women for all seasons,DragonRep123Corteiz,https://cnfair.com/detail/PI24030077384
"Minustwo cargos Printed patchwork overalls, trendy casual high street trousers ins super popular and versatile af1",轩翔潮流,https://cnfair.com/detail/PI24030077385
hat,411AD092E6119FAA8C4EE75A42EB27AC,https://cnfair.com/detail/PI24030077388
1,A5146A214D83688811A8253DD064BEA0,https://cnfair.com/detail/PI24030077389
"Customized, customized spraying, customized sto jacket",sir,https://cnfair.com/detail/PI24030077390
Full printed coin connected 2 color shirt short sleeve 771173,日出20228602,https://cnfair.com/detail/PI24030077393
21SS European and American hip-hop singers have the same foam letter 555555 printed male and female couple sweatshirt hoodie trendy,深圳市鑫泰都国际贸易有限公司,https://cnfair.com/detail/PI24030077403
apparel,411AD092E6119FAA8C4EE75A42EB27AC,https://cnfair.com/detail/PI24030077412
EE print shorts Printed logo Sweatpants mesh Drawstring American shorts,我需要神仙元2,https://cnfair.com/detail/PI24030077413
HUMAN Lil Uzi WAG Autumn and Winter Bat Gem Sweatshirt Couple Style Hooded Sweatshirt Couple Style,王爱国的店,https://cnfair.com/detail/PI24030077414
Trendy brand jeans men's spring and autumn loose thin straight trousers ins trend high street fashion casual pants for boys,裤潮衣点,https://cnfair.com/detail/PI24030077415
EE American Casual Fitness Shorts Men's Muscle Sports Quarter Pants Mesh Breathable Basketball Training Pants Street Trend,Musclemania官方店,https://cnfair.com/detail/PI24030077416
EE American Casual Fitness Shorts Men's Muscle Sports Quarter Pants Mesh Breathable Basketball Training Pants Street Trend,Musclemania官方店,https://cnfair.com/detail/PI24030077417
Men's Soft wash Natural cotton men's spring new oxford shirt solid color slim shirt,云端shop,https://cnfair.com/detail/PI24030077425
apparel,411AD092E6119FAA8C4EE75A42EB27AC,https://cnfair.com/detail/PI24030077426
trutyity,411AD092E6119FAA8C4EE75A42EB27AC,https://cnfair.com/detail/PI24030077430
Revenge sweatshirt keel embroidered palm oil painting XXX high street American niche skull thin jacket hoodie,vfor潮牌工作室,https://cnfair.com/detail/PI24030077438
xm U.K. Men's cardigan zip hooded sweatshirt pure cotton exit Two colors,bysh2017,https://cnfair.com/detail/PI24030077439
bsghhufi,411AD092E6119FAA8C4EE75A42EB27AC,https://cnfair.com/detail/PI24030077441
Shorts men's summer new style straight casual elastic waist basketball sports pants quick-drying three-quarter pants large pants three-point beach pants European and American simple elastic waist with intranet special price clearance original single tail cargo side cabinet cutting label,cgl夏米服饰企业店,https://cnfair.com/detail/PI24030077442
Korean style hat women's new V letter versatile rolled edge wool hat autumn and winter style cold hat warm knitted hat men's trend,义乌市佳谱电子商务商行,https://cnfair.com/detail/PI24030077449
Korean style hat women's new V letter versatile rolled edge wool hat autumn and winter style cold hat warm knitted hat men's trend,义乌市佳谱电子商务商行,https://cnfair.com/detail/PI24030077450
Hansolo new K groove short sleeve,韩韩出品HanSolo,https://cnfair.com/detail/PI24030077452
FEAR OF GOD FOG ESSENTIALS sweatshirt men's casual plus velvet American high street fashion brand couple set,FOG ESSENTIAlS,https://cnfair.com/detail/PI24030077454
ts broken lens t,GOAT-0,https://cnfair.com/detail/PI24030077455
clothing,411AD092E6119FAA8C4EE75A42EB27AC,https://cnfair.com/detail/PI24030077456
Black trousers with yellow pockets 790237,花生收割机,https://cnfair.com/detail/PI24030077458
apparel,411AD092E6119FAA8C4EE75A42EB27AC,https://cnfair.com/detail/PI24030077459
201# Foreign Trade Wool Hat Winter Korean Style Embroidered Letter Baotou Hat Men and Women Plaid Simple Fashion Knitted Hat,鼎顺针织厂,https://cnfair.com/detail/PI24030077472
Clothes Commit Tax Fraud Short Sleeve Men Graphic Tshirt,德品服装店,https://cnfair.com/detail/PI24030077476
purple-brand summer jeans men's 23 new elastic slim straight summer trendy casual trousers,潮品国际馆,https://cnfair.com/detail/PI24030077477
"EE casual shorts, fitness men's muscle sports shorts, trendy beach pants, mesh breathable, AliExpress cross-border supply",深圳市龙岗区北极狼人服装厂,https://cnfair.com/detail/PI24030077480
Angel King Niche sailing hooded sweatshirt for men and women European and American loose and versatile sky blue hoodie,ANGELKING47,https://cnfair.com/detail/PI24030077482
"20SS angel shorts Rainbow straight fashion side striped casual pants for men and women, three-quarter pants trendy",广州奕程贸易有限公司,https://cnfair.com/detail/PI24030077487
Reflective PF short sleeves for men and women European and American street fashion brand hip-hop loose hip-hop skateboard t-shirt top cotton Tee,欧美街头潮牌前线,https://cnfair.com/detail/PI24030077488
Correct version of gallery dept hand-painted splashed ink stitching drawstring high street casual sweatpants slightly flared long pants for men and women,FFCP Studios,https://cnfair.com/detail/PI24030077492
Correct version of gallery dept hand-painted splashed ink stitching drawstring high street casual sweatpants slightly flared long pants for men and women,FFCP Studios,https://cnfair.com/detail/PI24030077494
Mountain bike downhill 46 downhill suit Cycling clothing short-sleeved tops mountain off-road motorcycle racing clothing custom made,东莞批发定制骑行服,https://cnfair.com/detail/PI24030077496
yttuju,411AD092E6119FAA8C4EE75A42EB27AC,https://cnfair.com/detail/PI24030077498
apparel,411AD092E6119FAA8C4EE75A42EB27AC,https://cnfair.com/detail/PI24030077500
FEAR OF GOD multi-line ESSENTIALS reflective letter printing FOG men's and women's same style pure cotton casual shorts,农村人卖潮牌,https://cnfair.com/detail/PI24030077501
Angel King RTWSp5der Hoodie555 sweatshirt Spider HoodieYoung Same style as Thug,ANGELKING47,https://cnfair.com/detail/PI24030077507
Korean style hat women's new V letter versatile rolled edge wool hat autumn and winter style cold hat warm knitted hat men's trend,义乌市佳谱电子商务商行,https://cnfair.com/detail/PI24030077508
Men's sweatshirt CZ7858DC4199DJ6915CZ0440DA0111DJ0349DD4667DO1740CD6393,d[s113914131],https://cnfair.com/detail/PI24030077509
544,411AD092E6119FAA8C4EE75A42EB27AC,https://cnfair.com/detail/PI24030077513
544,411AD092E6119FAA8C4EE75A42EB27AC,https://cnfair.com/detail/PI24030077514
Fully enclosed non-adjustable hip-hop street dance embroidered sun protection baseball cap backward wearing size cap ny casual flat brim,外贸出口帽子批发,https://cnfair.com/detail/PI24030077517
Korean style ins furry versatile bear hat for women autumn and winter thickened plus velvet cute three-piece set warm fisherman hat,胡小北,https://cnfair.com/detail/PI24030077521
22SS Beach Shorts 2482,高端一号服饰,https://cnfair.com/detail/PI24030077523
Factory direct sales new hat wholesale brand trendy knitted hat men's thickened woolen hat autumn and winter solid color,广州宏鸿帽业商行,https://cnfair.com/detail/PI24030077524
European and American trendy brand Carhartt classic letter embroidered men's and women's loose hooded fleece hoodie sweatshirt,铅山县舒克特贸易有限公司,https://cnfair.com/detail/PI24030077526
Randi vibe pants B01 double knee canvas logging pants overalls men's American denim trousers cleanfit,大光头燃弟,https://cnfair.com/detail/PI24030077531
The sun never sets shark Basic model men terry Elasticity fitness shorts,阿丑先森外贸店,https://cnfair.com/detail/PI24030077532
yruyireyhu,411AD092E6119FAA8C4EE75A42EB27AC,https://cnfair.com/detail/PI24030077533
"Full face zipper sweatshirt, one piece to make new cross-border sweatshirt",漫萌工坊,https://cnfair.com/detail/PI24030077535
clothing,411AD092E6119FAA8C4EE75A42EB27AC,https://cnfair.com/detail/PI24030077538
down jacket,411AD092E6119FAA8C4EE75A42EB27AC,https://cnfair.com/detail/PI24030077539
European and American trendy brand letter printed casual loose sweatshirt Y2K hip hop street men and women pullover tops jacket trendy ins,防弹少年团TRAPSTAR外贸服装店,https://cnfair.com/detail/PI24030077543
Work wear trendy brand Carhartt Carhartt main line RE military style casual long pants multi-pocket loose men and women,十岁的猫,https://cnfair.com/detail/PI24030077544
Ice silk hood outdoor summer sun protection cycling scarf for men and women fishing mask covering face windproof camouflage hood,军酷旅户外,https://cnfair.com/detail/PI24030077547
Foreign Trade Pants Wholesale Warriors Lakers 76ers Heat Raptors Magic Pocket Shorts Baseball Basketball Pants,莆田市城厢区朝汉服装店,https://cnfair.com/detail/PI24030077548
American jeans men's spring washed distressed niche yellow mud-dyed trousers trendy high street loose straight pants,vesibo旗舰店,https://cnfair.com/detail/PI24030077549
Chest green Yuyu 22 color polo shirt 370517,tb1005773817的小店,https://cnfair.com/detail/PI24030077552
1996 cotton winter top thickened pink and orange brain-dead joint warm couple down jacket high-end jacket,田小妞的店铺,https://cnfair.com/detail/PI24030077558
Factory new hats wholesale brand hats knitted hats women's woolen hats men's Amazon AliExpress e-commerce cold hats,广州宏鸿帽业商行,https://cnfair.com/detail/PI24030077560
rhtjii,411AD092E6119FAA8C4EE75A42EB27AC,https://cnfair.com/detail/PI24030077567
European and American trendy brand new boat-shaped print American high street hooded sweatshirt streetwear Harajuku sweatshirt couple jacket,防弹少年团TRAPSTAR外贸服装店,https://cnfair.com/detail/PI24030077572
"TNF North Face North Face 1996 spliced pure down jacket (default Asian code,If you need US size, please buy one size up.,or remarks)",Big Dongle seller,https://cnfair.com/detail/PI24030077575
Chest Zhi Zhu Belly Situ Two Color Short Sleeves 621281,相逢一笑2002,https://cnfair.com/detail/PI24030077577
Hoodie,第九大街—-幕后造物主,https://cnfair.com/detail/PI24030077578
Wholesale trendy brand star same style palm angel decapitated bear printed short-sleeved t-shirts for men and women couples loose half-sleeved,广州物潮服装商行,https://cnfair.com/detail/PI24030077582
Wholesale trendy brand star same style palm angel decapitated bear printed short-sleeved t-shirts for men and women couples loose half-sleeved,广州物潮服装商行,https://cnfair.com/detail/PI24030077583
"FOG multi-line ESSENTIALS pure cotton trousers for men and women, the same FOG high street fashion brand casual leggings sweatpants",原创潮流社,https://cnfair.com/detail/PI24030077585
"TNF North Face North Face 1996 spliced pure down jacket (default Asian code,If you need US size, please buy one size up.,or remarks)",Big Dongle seller,https://cnfair.com/detail/PI24030077587
CP with sunglasses and black hat ch,位莱福士,https://cnfair.com/detail/PI24030077590
dwqigjuwdgi,411AD092E6119FAA8C4EE75A42EB27AC,https://cnfair.com/detail/PI24030077594
GYM Shark Cross Beauty Back Camouflage Bra High Waist Pants Yoga Wear Quick Drying Sports Fitness Suit Women's Belt Label,功夫萝莉,https://cnfair.com/detail/PI24030077597
Round neck with chest and back label ② color collar face wear 3101211,花生收割机,https://cnfair.com/detail/PI24030077600
Factory new hats wholesale brand hats knitted hats women's woolen hats men's Amazon AliExpress e-commerce cold hats,广州宏鸿帽业商行,https://cnfair.com/detail/PI24030077603
clothing,411AD092E6119FAA8C4EE75A42EB27AC,https://cnfair.com/detail/PI24030077604
reyfyi,411AD092E6119FAA8C4EE75A42EB27AC,https://cnfair.com/detail/PI24030077607
reyfyi,411AD092E6119FAA8C4EE75A42EB27AC,https://cnfair.com/detail/PI24030077608
[Heavy Industrial Washed and Distressed] Original Factory Quality Car Caha T B01 B136 washed distressed overalls Knee canvas logger pants Heavyweight fabric feels thick,草帽出品【八点开拍】,https://cnfair.com/detail/PI24030077609
apparel,411AD092E6119FAA8C4EE75A42EB27AC,https://cnfair.com/detail/PI24030077611
Angel King TS detachable hooded cotton jacket,ANGELKING47,https://cnfair.com/detail/PI24030077613
Hip-hop V personalized embroidered teardrop three-hole hat winter warm knitted head hat for men and women outdoor cycling cold protection mask,花生酱周边,https://cnfair.com/detail/PI24030077616
23SS 21SS 63051 CREWNECK SWEATSHIRT TOPSTONEY terry crew neck sweatshirt,TOPSTONEY,https://cnfair.com/detail/PI24030077618
"Arctic Face's co-branded goose down jacket is warm, thin, fashionable and cold-resistant, versatile and versatile for men and women, couple's bread jacket",石狮市嘉玲梦航服装厂,https://cnfair.com/detail/PI24030077624
apparel,411AD092E6119FAA8C4EE75A42EB27AC,https://cnfair.com/detail/PI24030077629
8-color knitted fabric health cloth can be used as cardigan and sweatshirt,好运布料行,https://cnfair.com/detail/PI24030077633
2023 Autumn and Winter New Zhou Dongyu Style Down Jacket Women's Short White Duck Down Couple Outfit Removable Loose Jacket Trendy,平湖市星叶服装店,https://cnfair.com/detail/PI24030077636
201# Foreign Trade Wool Hat Winter Korean Style Embroidered Letter Baotou Hat Men and Women Plaid Simple Fashion Knitted Hat,鼎顺针织厂,https://cnfair.com/detail/PI24030077637
2022 Beach Vacation Seaside Surfing Hot Spring Tour Classic foreign trade European and American casual breathable quick-drying beach pants,d[s309033680],https://cnfair.com/detail/PI24030077650
New European and American high street styles EE Men's and women's sports and leisure shorts beach pants,PAYDAY244,https://cnfair.com/detail/PI24030077651
CulturE niche structure design zipper slit slightly flared trousers vertical straight casual pants trousers for men and women,ArguE CulturE,https://cnfair.com/detail/PI24030077655
"Extremely thin and light! ikB ESSENTIAL ultra-thin woven running pants ! This summer’s hottest item! Direct supply to Xcat Mall orders Style number AA1998,The original price is 499 and there is no discount!",衣缘出品,https://cnfair.com/detail/PI24030077657
clothing,411AD092E6119FAA8C4EE75A42EB27AC,https://cnfair.com/detail/PI24030077659
201# Foreign Trade Wool Hat Winter Korean Style Embroidered Letter Baotou Hat Men and Women Plaid Simple Fashion Knitted Hat,鼎顺针织厂,https://cnfair.com/detail/PI24030077663
fytjhu,411AD092E6119FAA8C4EE75A42EB27AC,https://cnfair.com/detail/PI24030077664
IAN CONNOR SICKO TRUCKER HAT American retro truck cap baseball cap Atlanta limited edition,TSARCHIVE,https://cnfair.com/detail/PI24030077665
apparel,411AD092E6119FAA8C4EE75A42EB27AC,https://cnfair.com/detail/PI24030077666
Canadian style big goose down jacket new version 29 styles for men and women couples top version white duck down 3808,石狮市桥波方体网络服装商行,https://cnfair.com/detail/PI24030077667
sports Shorts Large size loose breathable knee length pants casual running pants fitness Aj23 basketball pants men's summer,街头篮球裤工厂店,https://cnfair.com/detail/PI24030077672
Back basic white letters 11 color vest rabbit,点点小牙签,https://cnfair.com/detail/PI24030077676
Fully enclosed non-adjustable hip-hop street dance embroidered sun protection baseball cap backward wearing size cap ny casual flat brim,外贸出口帽子批发,https://cnfair.com/detail/PI24030077677
CH Cro Hat Embroidered Fashion Hip Hop Visor Mesh Hat Women's Pingyang Baseball Cap,TaurusReps,https://cnfair.com/detail/PI24030077678
Left pocket Little Red Horse three-color cuffed trousers 492239,2022不期而遇,https://cnfair.com/detail/PI24030077679
Lakers James retro embroidered American basketball shorts loose breathable Magic Bulls knee-length pants for men,ABCD运动服饰,https://cnfair.com/detail/PI24030077681
Fully enclosed non-adjustable hip-hop street dance embroidered sun protection baseball cap backward wear la size cap ny flat brim hat,外贸出口帽子批发,https://cnfair.com/detail/PI24030077683
Fully enclosed non-adjustable hip-hop street dance embroidered sun protection baseball cap backward wear la size cap ny flat brim hat,外贸出口帽子批发,https://cnfair.com/detail/PI24030077684
GA series short-sleeved black with green letters on the back,chaos new,https://cnfair.com/detail/PI24030077689
Shark shorts men's Japanese trendy brand casual pants summer five-point pants youth street hip-hop sweatpants trendy mid-pants,木子潮品168,https://cnfair.com/detail/PI24030077693
Pocket green jade ⑤ color trousers 3102410,花生收割机,https://cnfair.com/detail/PI24030077694
EE print shorts Printed logo Sweatpants mesh Drawstring American shorts,我需要神仙元2,https://cnfair.com/detail/PI24030077701
clothing,This Is Sad Too,https://cnfair.com/detail/PI24030077702
bsguhf,411AD092E6119FAA8C4EE75A42EB27AC,https://cnfair.com/detail/PI24030077704
Fully enclosed non-adjustable hip-hop street dance embroidered sun protection baseball cap backward wear la size cap ny flat brim hat,外贸出口帽子批发,https://cnfair.com/detail/PI24030077705
Fully enclosed non-adjustable hip-hop street dance embroidered sun protection baseball cap backward wear la size cap ny flat brim hat,外贸出口帽子批发,https://cnfair.com/detail/PI24030077706
"GUCCI Peaked Cap Popular adjustable baseball cap Men's and women's versatile sun hats, peaked caps, mesh hats hiphop Hong Kong style casual hat travel trendy hat",球衣帽子小店,https://cnfair.com/detail/PI24030077708
Fully enclosed non-adjustable hip-hop street dance embroidered sun protection baseball cap backward wearing size cap ny casual flat brim,外贸出口帽子批发,https://cnfair.com/detail/PI24030077709
"Item No. 101824 Nine colors North Face patchwork embroidered down jacket Multiple embroideries on front and back cuffs,Handsome and handsome The preferred model for outdoor sports and trendy street brands Artificial hand stuffed high weight down cotton Warm, stylish and not bulky Soft and delicate No deformation opaque Same style for men and women",BAT SHOP 蝙蝠商社,https://cnfair.com/detail/PI24030077710
Independent and original trendy brands nksup 22ss week14 arc corduroy hooded jacket Letter embroidered co-branded corduroy zipper hooded jacket gx,戴头盔的谢腾飞有货就发没货退款,https://cnfair.com/detail/PI24030077713
West Coast trendy shorts Ericemanuel EE American shorts men's sports casual plus size hip hop shorts,上饶市吉米电子商务有限公司,https://cnfair.com/detail/PI24030077714
ASK series short sleeves heavy relief foam simple,tb6034025635的小店,https://cnfair.com/detail/PI24030077717
